{
  "schemaVersion": 1,
  "generatedAt": "2026-06-22T04:11:23.575Z",
  "projects": [
    {
      "id": "1shell",
      "name": "1Shell",
      "repo": "weidu12123/1Shell",
      "url": "https://github.com/weidu12123/1Shell",
      "cloneUrl": "https://github.com/weidu12123/1Shell.git",
      "report": "reports/1Shell.md",
      "reportFile": "1Shell",
      "category": "Tools / Infrastructure / Distribution",
      "summary": "1Shell 是一个本地优先的 WebSSH + 多 VPS 运维中枢 + Remote MCP Server，把主机、终端、文件、脚本、探针、审计、Program/Skill 和 1Shell AI 网关组织成“人和 Agent 共用”的服务器运维控制面。",
      "adoption": null,
      "architectureValue": 5,
      "license": "MIT",
      "language": "JavaScript；GitHub languages：JS 1.14MB、Vue 0.73MB、TypeScript 0.26MB、Go 0.06MB",
      "analysisDate": "2026-06-10",
      "sourceDir": "projects/weidu12123__1Shell",
      "owner": "weidu12123",
      "sourceExists": true,
      "tags": [
        "agent",
        "mcp",
        "typescript",
        "go"
      ]
    },
    {
      "id": "agent-reach",
      "name": "Agent Reach",
      "repo": "Panniantong/agent-reach",
      "url": "https://github.com/Panniantong/agent-reach",
      "cloneUrl": "https://github.com/Panniantong/agent-reach.git",
      "report": "reports/agent-reach.md",
      "reportFile": "agent-reach",
      "category": "AI Coding / Agent Workflow",
      "summary": "Agent Reach 是给 AI Agent 装“互联网读取与搜索能力”的本地能力层：它不自己实现完整爬虫/浏览器/搜索引擎，而是为 Twitter/X、Reddit、YouTube、GitHub、B站、小红书、V2EX、雪球、RSS、Exa、网页等渠道选择、安装、体检和路由当下最可用的上游工具，让宿主 Agent 直接调用这些工具完成内容获取。",
      "adoption": null,
      "architectureValue": 5,
      "license": "MIT",
      "language": "Python",
      "analysisDate": "2026-06-16",
      "sourceDir": "projects/Panniantong__agent-reach",
      "owner": "Panniantong",
      "sourceExists": true,
      "tags": [
        "agent",
        "coding",
        "workflow",
        "python"
      ]
    },
    {
      "id": "aihub",
      "name": "AIHub / AI Memory Hub",
      "repo": "Vincent-chao-lang/AIHub",
      "url": "https://github.com/Vincent-chao-lang/AIHub",
      "cloneUrl": "https://github.com/Vincent-chao-lang/AIHub.git",
      "report": "reports/AIHub.md",
      "reportFile": "AIHub",
      "category": "Code Intelligence / RAG / Knowledge",
      "summary": "用 Chrome 扩展自动采集 ChatGPT / Claude / Gemini / Kimi / DeepSeek 对话，并用本地 FastAPI + SQLite + ChromaDB / BGE 构建“企业 AI 对话知识资产库”的早期 MVP。",
      "adoption": "观望。个人 PoC 可以试；企业生产不建议直接采用。",
      "architectureValue": 4,
      "license": null,
      "language": "Python（GitHub 元数据）；实际为 Python + TypeScript/React + Chrome Extension JS",
      "analysisDate": "2026-05-31",
      "sourceDir": "projects/Vincent-chao-lang__AIHub",
      "owner": "Vincent-chao-lang",
      "sourceExists": true,
      "tags": [
        "rag",
        "knowledge",
        "typescript",
        "python"
      ]
    },
    {
      "id": "cli-anything",
      "name": "CLI-Anything",
      "repo": "HKUDS/CLI-Anything",
      "url": "https://github.com/HKUDS/CLI-Anything",
      "cloneUrl": "https://github.com/HKUDS/CLI-Anything.git",
      "report": "reports/CLI-Anything.md",
      "reportFile": "CLI-Anything",
      "category": "Tools / Infrastructure / Distribution",
      "summary": "CLI-Anything 是一套把 GUI / 桌面 / 服务 / 专业软件变成 Agent-native CLI 的工程方法论、跨宿主 agent 技能/插件、CLI-Hub 注册表、Preview artifact 协议与 CLI Matrix 多工具工作流层；它的核心价值不是“自动生成一个命令行壳”，而是把真实软件能力包装成可被 Agent 稳定发现、调用、预检、组合、验证和分发的命令面。",
      "adoption": null,
      "architectureValue": 5,
      "license": "Apache-2.0（仓库根 LICENSE）；多个 harness / package metadata 仍残留 MIT / GPL classifier，见风险说明",
      "language": "Python 为主，少量 JavaScript / TypeScript / C# / Shell / Swift",
      "analysisDate": "2026-06-15",
      "sourceDir": "projects/HKUDS__CLI-Anything",
      "owner": "HKUDS",
      "sourceExists": true,
      "tags": [
        "agent",
        "cli",
        "typescript",
        "python"
      ]
    },
    {
      "id": "codegraph",
      "name": "CodeGraph",
      "repo": "colbymchenry/codegraph",
      "url": "https://github.com/colbymchenry/codegraph",
      "cloneUrl": "https://github.com/colbymchenry/codegraph.git",
      "report": "reports/codegraph.md",
      "reportFile": "codegraph",
      "category": "Code Intelligence / RAG / Knowledge",
      "summary": "一句话定位：CodeGraph 是一个 MIT 许可、本地优先的代码知识图谱库 + CLI + MCP Server，用 tree-sitter 把项目索引成 SQLite/FTS5 符号图，再让 Claude Code、Cursor、Codex CLI、opencode 等 Agent 用少量工具调用完成代码探索。",
      "adoption": "推荐采用（个人/小团队/内部 PoC） / 企业核心强制标准件暂时观望。",
      "architectureValue": 5,
      "license": "MIT",
      "language": "TypeScript",
      "analysisDate": "2026-05-21",
      "sourceDir": "projects/colbymchenry__codegraph",
      "owner": "colbymchenry",
      "sourceExists": true,
      "tags": [
        "agent",
        "mcp",
        "rag",
        "knowledge",
        "cli",
        "graph",
        "typescript"
      ]
    },
    {
      "id": "codexdesktop-rebuild",
      "name": "CodexDesktop-Rebuild",
      "repo": "Haleclipse/CodexDesktop-Rebuild",
      "url": "https://github.com/Haleclipse/CodexDesktop-Rebuild",
      "cloneUrl": "https://github.com/Haleclipse/CodexDesktop-Rebuild.git",
      "report": "reports/CodexDesktop-Rebuild.md",
      "reportFile": "CodexDesktop-Rebuild",
      "category": "Tools / Infrastructure / Distribution",
      "summary": "基于逆向工程将 OpenAI 官方仅支持 macOS 的 Codex Desktop 应用重新打包为跨平台（macOS/Windows/Linux）独立安装包的 Electron 重分发项目。",
      "adoption": "❌ 不推荐采用（生产环境） / ⚠️ 观望（个人尝鲜）",
      "architectureValue": 4,
      "license": "未声明（⚠️ 风险）",
      "language": "JavaScript",
      "analysisDate": "2026-05-09",
      "sourceDir": "projects/Haleclipse__CodexDesktop-Rebuild",
      "owner": "Haleclipse",
      "sourceExists": true,
      "tags": [
        "cli",
        "desktop"
      ]
    },
    {
      "id": "compound-engineering-plugin",
      "name": "compound-engineering-plugin",
      "repo": "EveryInc/compound-engineering-plugin",
      "url": "https://github.com/EveryInc/compound-engineering-plugin",
      "cloneUrl": "https://github.com/EveryInc/compound-engineering-plugin.git",
      "report": "reports/compound-engineering-plugin.md",
      "reportFile": "compound-engineering-plugin",
      "category": "AI Coding / Agent Workflow",
      "summary": "Compound Engineering 是 EveryInc 把“复利工程”编码成 AI coding workflow 的插件系统：以 Claude Code 插件资产为单一源码，向 Codex、OpenCode、Pi、Gemini、Kiro 等宿主转换分发，并用 39 个 skills、43 个 agents 组织 brainstorm → plan → work → review → compound 的团队协作闭环。",
      "adoption": null,
      "architectureValue": 5,
      "license": "MIT",
      "language": null,
      "analysisDate": "2026-06-16",
      "sourceDir": "projects/EveryInc__compound-engineering-plugin",
      "owner": "EveryInc",
      "sourceExists": true,
      "tags": [
        "agent",
        "coding",
        "workflow"
      ]
    },
    {
      "id": "cyberverse",
      "name": "CyberVerse",
      "repo": "dsd2077/CyberVerse",
      "url": "https://github.com/dsd2077/CyberVerse",
      "cloneUrl": "https://github.com/dsd2077/CyberVerse.git",
      "report": "reports/CyberVerse.md",
      "reportFile": "CyberVerse",
      "category": "Agent Platform / Desktop / Design",
      "summary": "CyberVerse 是一个开源实时音视频数字人 Agent 平台，用 Go 编排 WebRTC / 会话 / 媒体管线，用 Python gRPC 推理服务承载 ASR、TTS、Omni、RAG、PersonaAgent 和 FlashHead / LiveAct 头像视频插件，用 Vue 前端提供角色、会话、设置、知识库和任务 UI；它更像“可自托管的实时语音/视频数字人基座”，不是通用 workflow 平台，也不是单纯 avatar demo。",
      "adoption": null,
      "architectureValue": 5,
      "license": "GPL-3.0",
      "language": "Python（GitHub API）；实际是 Python + Go + Vue/TypeScript",
      "analysisDate": "2026-05-20",
      "sourceDir": "projects/dsd2077__CyberVerse",
      "owner": "dsd2077",
      "sourceExists": true,
      "tags": [
        "agent",
        "rag",
        "desktop",
        "workflow",
        "design",
        "typescript",
        "python",
        "go"
      ]
    },
    {
      "id": "ecc",
      "name": "ECC",
      "repo": "affaan-m/ECC",
      "url": "https://github.com/affaan-m/ECC",
      "cloneUrl": "https://github.com/affaan-m/ECC.git",
      "report": "reports/ECC.md",
      "reportFile": "ECC",
      "category": "AI Coding / Agent Workflow",
      "summary": "ECC 是一套跨 Claude Code、Codex、OpenCode、Cursor、Gemini、Qwen、Zed 等 AI coding harness 的“工作流操作系统 / 性能优化层”：把 agents、skills、rules、commands、hooks、MCP 配置、选择性安装 manifests、continuous learning 和 ECC2 控制面放到一个可安装、可测试、可演进的公开仓库里。",
      "adoption": "推荐采用（profile / skill / hooks 层） / 观望（ECC2 控制面）",
      "architectureValue": 5,
      "license": "MIT",
      "language": "JavaScript / Markdown 为主，另有 Rust、Python、Shell、TypeScript、YAML 等",
      "analysisDate": "2026-06-05",
      "sourceDir": "projects/affaan-m__ECC",
      "owner": "affaan-m",
      "sourceExists": true,
      "tags": [
        "agent",
        "coding",
        "mcp",
        "workflow",
        "rust",
        "typescript",
        "python"
      ]
    },
    {
      "id": "gitingest",
      "name": "gitingest",
      "repo": "coderamp-labs/gitingest",
      "url": "https://github.com/coderamp-labs/gitingest",
      "cloneUrl": "https://github.com/coderamp-labs/gitingest.git",
      "report": "reports/gitingest.md",
      "reportFile": "gitingest",
      "category": "Code Intelligence / RAG / Knowledge",
      "summary": "将任意 Git 仓库一键转换为 LLM-friendly 文本摘要的代码摄取工具（类似 Repomix，但自带 Web 服务和浏览器扩展）。",
      "adoption": "推荐采用（个人/小团队）",
      "architectureValue": 4,
      "license": "MIT",
      "language": "Python",
      "analysisDate": "2026-05-02",
      "sourceDir": "projects/coderamp-labs__gitingest",
      "owner": "coderamp-labs",
      "sourceExists": true,
      "tags": [
        "rag",
        "knowledge",
        "python"
      ]
    },
    {
      "id": "gitnexus",
      "name": "GitNexus",
      "repo": "abhigyanpatwari/GitNexus",
      "url": "https://github.com/abhigyanpatwari/GitNexus",
      "cloneUrl": "https://github.com/abhigyanpatwari/GitNexus.git",
      "report": "reports/GitNexus.md",